{
  "agent": {
    "description": null,
    "endpoints": [
      "https://fdy-demo-agents-de-em.services.ai.azure.com/api/projects/preflight/assistants/asst_Y3XUjyknLU4ZzR732qhPDe7F"
    ],
    "environment": "https://fdy-demo-agents-de-em.services.ai.azure.com/api/projects/preflight",
    "id": "asst_Y3XUjyknLU4ZzR732qhPDe7F",
    "identity": {
      "appId": null,
      "blueprint": null,
      "kind": "unknown",
      "mode": "unknown",
      "objectId": null,
      "owner": null,
      "sponsor": null
    },
    "inboundAuth": "unknown",
    "instructions": {
      "capChars": null,
      "hash": "sha256:921d52b7d3976232fdfa4ea1858ea1c3b93f04dee07706eb306400d12a622c38",
      "tokens": 31
    },
    "name": "records-agent",
    "platform": "foundry",
    "sourceFile": "fixtures\\03-records-agent\\agent.json"
  },
  "bomFormat": "AgentBOM",
  "economics": {
    "estimatedCostPerInteraction": null,
    "fanoutFactor": 1.0,
    "groundingTokensPerTurn": 0,
    "instructionTokens": 31,
    "toolDescriptionTokens": 25
  },
  "edges": [],
  "generated": "2026-09-14T16:53:07.432927Z",
  "generator": {
    "collector": "foundry@0.1.0",
    "tool": "preflight",
    "version": "0.1.0"
  },
  "guards": {
    "contentFilter": "none",
    "historySummarisation": null,
    "humanInTheLoop": false,
    "maxTurns": null,
    "promptShields": false,
    "rateLimit": null,
    "tokenCap": null
  },
  "knowledge": [],
  "models": [
    {
      "capacity": null,
      "contextWindow": null,
      "deployment": "gpt-5-mini-global",
      "model": "gpt-5-mini-global",
      "region": "switzerlandnorth",
      "sku": null,
      "status": "unknown",
      "version": null
    }
  ],
  "residency": {
    "declared": null,
    "observed": [
      "switzerlandnorth"
    ]
  },
  "serialNumber": "urn:uuid:77afde95-3c67-5d29-a299-047945aa7cbd",
  "signature": null,
  "specVersion": "0.1",
  "storage": [],
  "tags": {
    "declared": "guards"
  },
  "tools": [
    {
      "annotations": {
        "destructiveHint": null,
        "idempotentHint": null,
        "openWorldHint": false,
        "readOnlyHint": true
      },
      "approval": null,
      "auth": {
        "mode": "key",
        "scopes": [],
        "secretRef": "inline"
      },
      "classification": {
        "confidence": "low",
        "irreversibleAction": true,
        "rationale": "Annotations present but server 'https://mcp.records.contoso-internal.example/mcp' is not on the trusted list, so they cannot be relied on (MCP spec). Assumed worst case.",
        "source": "failclosed",
        "untrustedInput": true
      },
      "description": "Fetch a contract record by id.",
      "descriptionTokens": 8,
      "id": "mcp:records/get_record",
      "kind": "mcp",
      "name": "get_record",
      "referencedInInstructions": null,
      "source": {
        "allowlist": false,
        "builtinId": null,
        "httpMethod": null,
        "manifestHash": "sha256:97fb4eedabc11f58a6e7061e35b6c3850d8c9720579766f909043b26d23d0fac",
        "pinned": null,
        "server": "https://mcp.records.contoso-internal.example/mcp",
        "toolbox": null,
        "trusted": false
      }
    },
    {
      "annotations": {
        "destructiveHint": null,
        "idempotentHint": null,
        "openWorldHint": false,
        "readOnlyHint": true
      },
      "approval": null,
      "auth": {
        "mode": "key",
        "scopes": [],
        "secretRef": "inline"
      },
      "classification": {
        "confidence": "low",
        "irreversibleAction": true,
        "rationale": "Annotations present but server 'https://mcp.records.contoso-internal.example/mcp' is not on the trusted list, so they cannot be relied on (MCP spec). Assumed worst case.",
        "source": "failclosed",
        "untrustedInput": true
      },
      "description": "Search contract records.",
      "descriptionTokens": 6,
      "id": "mcp:records/search_records",
      "kind": "mcp",
      "name": "search_records",
      "referencedInInstructions": null,
      "source": {
        "allowlist": false,
        "builtinId": null,
        "httpMethod": null,
        "manifestHash": "sha256:97fb4eedabc11f58a6e7061e35b6c3850d8c9720579766f909043b26d23d0fac",
        "pinned": null,
        "server": "https://mcp.records.contoso-internal.example/mcp",
        "toolbox": null,
        "trusted": false
      }
    },
    {
      "annotations": {
        "destructiveHint": true,
        "idempotentHint": false,
        "openWorldHint": false,
        "readOnlyHint": false
      },
      "approval": null,
      "auth": {
        "mode": "key",
        "scopes": [],
        "secretRef": "inline"
      },
      "classification": {
        "confidence": "high",
        "irreversibleAction": true,
        "rationale": "Server 'https://mcp.records.contoso-internal.example/mcp' is not on the trusted list, so its annotations cannot reduce risk, but it declares this tool destructive, and an annotation that worsens a classification is accepted from any server.",
        "source": "protocol",
        "untrustedInput": true
      },
      "description": "Permanently delete a contract record by id.",
      "descriptionTokens": 11,
      "id": "mcp:records/delete_record",
      "kind": "mcp",
      "name": "delete_record",
      "referencedInInstructions": null,
      "source": {
        "allowlist": false,
        "builtinId": null,
        "httpMethod": null,
        "manifestHash": "sha256:97fb4eedabc11f58a6e7061e35b6c3850d8c9720579766f909043b26d23d0fac",
        "pinned": null,
        "server": "https://mcp.records.contoso-internal.example/mcp",
        "toolbox": null,
        "trusted": false
      }
    }
  ]
}